职位名字,公司名字,公司类型,薪资,地区,工作年限,发布日期,福利,经验,学历,所属行业
通信算法工程师,成都振芯科技股份有限公司,民营公司,1.2-1.8万/月,成都-高新区,4,2021-10-26 08:52:50,周末双休 五险一金 绩效奖金 全勤奖 节日福利 餐饮补贴 商业保险,2年经验,本科,电子技术/半导体/集成电路
RFID算法工程师,北京御芯微科技有限公司,民营公司,1-2.5万/月,成都-高新区,4,2021-10-26 08:38:16,五险一金 餐饮补贴 通讯补贴 专业培训 出国机会 绩效奖金 年终奖金 股票期权 弹性工作,2年经验,本科,电子技术/半导体/集成电路
通信算法工程师,北京御芯微科技有限公司,民营公司,1-2.5万/月,成都-高新区,10,2021-10-26 08:38:16,五险一金 餐饮补贴 通讯补贴 专业培训 出国机会 绩效奖金 年终奖金 股票期权 弹性工作,无需经验,本科,电子技术/半导体/集成电路
机器学习/AI算法工程师,中国电子科技集团公司第十研究所,事业单位,1.5-2万/月,成都-金牛区,3,2021-10-26 04:01:15,五险一金 补充医疗保险 餐饮补贴 专业培训 绩效奖金 年终奖金 定期体检 住房补贴 单身宿舍,1年经验,硕士,电子技术/半导体/集成电路
算法工程师：机器视觉领域,杭州国翌科技有限公司,民营公司,1.2-2.4万/月,成都-高新区,4,2021-10-25 11:51:30,五险一金 年终奖金 绩效奖金 定期体检 补充医疗保险 专业培训 节日福利,2年经验,本科,电子技术/半导体/集成电路
信号处理算法工程师,深圳市易探科技有限公司,民营公司,1-1.5万/月,成都-郫都区,3,2021-10-25 11:27:03,,1年经验,本科,电子技术/半导体/集成电路
旋翼控制算法工程师,成都纵横自动化技术股份有限公司,民营公司,1-2万/月,成都-高新区,5,2021-10-25 10:36:48,五险一金 年终奖金 定期体检 餐饮补贴 通讯补贴 专业培训 交通补贴,3-4年经验,本科,仪器仪表/工业自动化
遥感算法工程师,成都纵横自动化技术股份有限公司,民营公司,1-2万/月,成都-高新区,4,2021-10-25 10:36:47,五险一金 年终奖金 定期体检 餐饮补贴 通讯补贴 专业培训 交通补贴,2年经验,本科,仪器仪表/工业自动化
控制算法工程师,成都纵横自动化技术股份有限公司,民营公司,1.2-2.4万/月,成都-高新区,5,2021-10-25 10:36:45,五险一金 年终奖金 定期体检 餐饮补贴 通讯补贴 专业培训 交通补贴,3-4年经验,硕士,仪器仪表/工业自动化
C-model与算法工程师,芯原微电子（成都）有限公司,外资（欧美）,30-40万/年,成都-高新区,3,2021-10-25 09:30:27,交通补贴 餐饮补贴 健身房 下午茶,1年经验,本科,电子技术/半导体/集成电路
DSP算法/软件工程师,芯原微电子（成都）有限公司,外资（欧美）,30-40万/年,成都-高新区,4,2021-10-25 09:30:27,,2年经验,本科,电子技术/半导体/集成电路
信号处理/算法工程师,成都博宇利华科技有限公司,民营公司,1.2-2.4万/月,成都-武侯区,3,2021-10-25 09:23:42,五险一金 交通补贴 通讯补贴 年终奖金 弹性工作 专业培训 定期体检,1年经验,本科,计算机软件
python算法工程师,成都星云智联科技有限公司,国企,1-1.6万/月,成都-金牛区,5,2021-10-25 09:09:25,五险一金 专业培训 绩效奖金 年终奖金 定期体检,3-4年经验,大专,计算机软件
Python算法工程师,成都星云智联科技有限公司,国企,1-1.6万/月,成都-金牛区,5,2021-10-25 09:09:25,五险一金 专业培训 绩效奖金 年终奖金 定期体检,3-4年经验,大专,计算机软件
算法工程师,成都星云智联科技有限公司,国企,1.5-2.5万/月,成都-金牛区,5,2021-10-25 09:09:25,,3-4年经验,大专,计算机软件
优化算法研发工程师,英特工程仿真技术（大连）有限公司,民营公司,1-2万/月,大连,10,2021-10-25 08:14:12,五险一金 交通补贴 绩效奖金 年终奖金 定期体检 通讯补贴 餐饮补贴 研发奖金 专业培训 节日福利,无需经验,硕士,计算机软件
CSIG15-智能平台产品部-算法后台开发工程师（成都）,深圳市腾讯计算机系统有限公司,民营公司,,成都,5,2021-10-25 07:04:19,,3-4年经验,本科,互联网/电子商务
15575-《王者荣耀》推荐算法高级工程师（成都）,深圳市腾讯计算机系统有限公司,民营公司,,成都,5,2021-10-25 07:03:50,,3-4年经验,硕士,互联网/电子商务
15575-《王者荣耀》高级推荐算法工程师（成都）,深圳市腾讯计算机系统有限公司,民营公司,,成都,5,2021-10-25 07:03:06,,3-4年经验,硕士,互联网/电子商务
图像算法助理工程师,成都术有云视觉科技有限公司,民营公司,15-20万/年,成都-高新区,4,2021-10-24 17:25:38,,2年经验,本科,仪器仪表/工业自动化
图像算法工程师,成都术有云视觉科技有限公司,民营公司,20-30万/年,成都-高新区,6,2021-10-24 17:25:38,,5-7年经验,本科,仪器仪表/工业自动化
FPGA算法工程师,慧众行知科技（北京）有限公司,民营公司,1-2.5万/月,成都-武侯区,3,2021-10-22 17:00:34,,1年经验,本科,计算机软件
高级控制算法工程师,四川航电微能源有限公司,民营公司,19-26万/年,成都-成华区,6,2021-10-22 16:17:17,五险一金 年终奖金 福利年假 餐饮补贴 专业培训 定期体检,5-7年经验,本科,新能源
通信算法工程师,成都众享天地网络科技有限公司,民营公司,1.5-3万/月,成都-郫都区,10,2021-10-22 09:39:34,五险一金 绩效奖金 年终奖金 弹性工作 员工旅游 餐饮补贴 交通补贴 定期体检,无需经验,本科,计算机软件
C++算法工程师,成都众享天地网络科技有限公司,民营公司,1.5-3万/月,成都-郫都区,10,2021-10-22 09:39:29,员工旅游 交通补贴 餐饮补贴 绩效奖金 年终奖金 弹性工作 五险一金 定期体检,无需经验,招3人,计算机软件
点云算法工程师,北京数字绿土科技有限公司,民营公司,1.8-3.5万/月,成都-高新区,4,2021-10-22 09:11:57,五险一金 交通补贴 补充医疗保险 弹性工作 股票期权 年终奖金 绩效奖金 定期体检 员工旅游 免费班车,2年经验,本科,计算机软件
组合导航算法工程师,北京数字绿土科技有限公司,民营公司,2-4万/月,成都-高新区,4,2021-10-22 09:11:56,五险一金 交通补贴 补充医疗保险 弹性工作 股票期权 年终奖金 绩效奖金 定期体检 员工旅游 免费班车,2年经验,硕士,计算机软件
图像算法工程师,深圳安智杰科技有限公司,民营公司,0.8-1.5万/月,成都-郫都区,3,2021-10-21 21:10:23,五险一金 员工旅游 绩效奖金 定期体检,1年经验,本科,电子技术/半导体/集成电路
雷达算法工程师,深圳安智杰科技有限公司,民营公司,0.8-1.5万/月,成都-郫都区,5,2021-10-21 21:10:23,五险一金 员工旅游 绩效奖金 定期体检,3-4年经验,本科,电子技术/半导体/集成电路
GPU算法工程师,慧众行知科技（北京）有限公司,民营公司,1-1.8万/月,成都-武侯区,5,2021-10-21 17:57:46,,3-4年经验,本科,计算机软件
算法工程师（通信方向）,北京科电航宇空间技术有限公司,民营公司,1-2.5万/月,成都-青羊区,6,2021-10-21 15:06:50,五险一金 餐饮补贴 弹性工作 定期体检 通讯补贴 补充医疗保险 年终奖金 员工旅游,5-7年经验,本科,电子技术/半导体/集成电路
算法工程师+医疗+13薪,四川知周科技有限责任公司,民营公司,1.5-2万/月,成都-高新区,6,2021-10-21 14:06:16,五险一金 节日福利 餐饮补贴 年终奖金 补充医疗保险,5-7年经验,硕士,计算机软件
图像算法工程师（无创监测）,四川知周科技有限责任公司,民营公司,1.5-2万/月,成都-武侯区,4,2021-10-21 14:06:16,五险一金 补充医疗保险 餐饮补贴 年终奖金 补充公积金,2年经验,硕士,计算机软件
算法工程师,四川知周科技有限责任公司,民营公司,1.3-1.6万/月,成都-武侯区,3,2021-10-21 14:06:16,,1年经验,硕士,计算机软件
高级算法工程师,四川知周科技有限责任公司,民营公司,1.5-3万/月,成都-高新区,5,2021-10-21 14:06:16,五险一金 带薪年假 餐饮补贴 年终奖金,3-4年经验,硕士,计算机软件
机器人算法工程师,成都睿芯行科技有限公司,民营公司,1.5-2.5万/月,成都-高新区,5,2021-10-20 11:38:21,五险一金 定期体检 股票期权 年终奖金 弹性工作,3-4年经验,本科,电子技术/半导体/集成电路
机器人视觉算法工程师,成都睿芯行科技有限公司,民营公司,1.5-2.5万/月,成都-高新区,5,2021-10-20 11:38:19,五险一金 定期体检 股票期权 年终奖金 弹性工作,3-4年经验,本科,电子技术/半导体/集成电路
算法工程师,车路通科技（成都）有限公司,民营公司,1.8-3.5万/月,成都,5,2021-10-20 10:06:06,五险一金 年终奖金 绩效奖金,3-4年经验,硕士,电子技术/半导体/集成电路
算法工程师（谱分析）,上海奕瑞光电子科技股份有限公司,上市公司,1-2万/月,成都-郫都区,3,2021-10-20 09:33:29,五险一金 补充医疗保险 补充公积金 免费班车 餐饮补贴 年终奖金 定期体检,1年经验,硕士,医疗设备/器械
视觉算法工程师,四川苹乐华创智能装备有限公司,创业公司,1-1.5万/月,成都-高新区,4,2021-10-19 21:31:12,五险一金 免费班车 员工旅游 出国机会 弹性工作 定期体检,2年经验,硕士,计算机软件
视觉算法工程师,广州辰创科技发展有限公司,民营公司,2-2.5万/月,成都-金牛区,6,2021-10-19 16:14:24,五险一金 年终奖金,5-7年经验,本科,通信/电信/网络设备
算法工程师,成都华微电子科技有限公司,国企,3-6万/月,成都,3,2021-10-19 15:35:18,五险一金 定期体检,1年经验,本科,电子技术/半导体/集成电路
算法设计工程师 — 光子链路仿真,深圳市贝思科尔软件技术有限公司,民营公司,1.2-2.4万/月,成都-武侯区,5,2021-10-19 09:17:55,周末双休 五险一金 弹性工作 通讯补贴,3-4年经验,硕士,计算机软件
算法工程师-储能方向,清华四川能源互联网研究院,事业单位,1-1.5万/月,成都-天府新区,10,2021-10-19 09:17:12,,无需经验,硕士,电气/电力/水利
算法工程师,天津大学四川创新研究院,事业单位,1-2万/月,青岛,5,2021-10-18 17:08:14,,3-4年经验,硕士,电子技术/半导体/集成电路
算法工程师（中级）,成都青程融创信息技术有限公司,民营公司,1-1.5万/月,成都-高新区,4,2021-10-18 10:26:51,五险一金 专业培训 周末双休 免费下午茶,2年经验,本科,电子技术/半导体/集成电路
运动控制算法开发工程师(000590),西安铂力特增材技术股份有限公司,民营公司,1.5-3万/月,西安,5,2021-10-18 09:20:52,做五休二 周末双休 五险一金 节日福利 生日福利 通勤班车 定期体检 年终奖金,3-4年经验,本科,机械/设备/重工
通信与信号算法工程师,中国电子科技集团公司第十研究所,事业单位,18-30万/年,成都-金牛区,3,2021-10-14 18:14:39,五险一金 补充医疗保险 通讯补贴 餐饮补贴 专业培训 绩效奖金 年终奖金 定期体检 住房补贴 单身宿舍,1年经验,硕士,电子技术/半导体/集成电路
软件算法工程师,中国电子科技集团公司第十研究所,事业单位,1.5-2万/月,成都-金牛区,5,2021-10-14 18:14:44,五险一金 补充医疗保险 通讯补贴 餐饮补贴 专业培训 绩效奖金 年终奖金 定期体检 住房补贴 单身宿舍,3-4年经验,硕士,电子技术/半导体/集成电路
算法工程师,国蓉科技有限公司,上市公司,2-2.5万/月,成都,4,2021-10-14 14:43:56,五险一金 免费班车 交通补贴 餐饮补贴 通讯补贴 专业培训 定期体检,2年经验,硕士,电子技术/半导体/集成电路
多媒体算法工程师,小米通讯技术有限公司,民营公司,3-6万/月,上海,5,2021-10-13 19:46:43,,3-4年经验,本科,通信/电信运营、增值服务
多媒体AI算法优化工程师,小米通讯技术有限公司,民营公司,3-6万/月,上海,5,2021-10-13 19:46:43,,3-4年经验,本科,通信/电信运营、增值服务
机器学习算法工程师,入迷（成都）信息技术有限公司,外资（欧美）,2-2.5万/月,成都-高新区,5,2021-10-13 09:25:01,五险一金 交通补贴 餐饮补贴 周末双休 定期体检 带薪年假 全勤奖,3-4年经验,本科,计算机软件
算法工程师,成都爱科特科技发展有限公司,上市公司,1.8-3.5万/月,成都-青羊区,5,2021-10-08 10:21:06,五险一金 弹性工作 年底双薪 员工旅游 加班补助 带薪年假,3-4年经验,本科,电子技术/半导体/集成电路
数据链算法工程师,成都能通科技股份有限公司,民营公司,1.5-2.5万/月,成都-武侯区,4,2021-09-29 17:45:21,五险一金 补充医疗保险 员工旅游 餐饮补贴 专业培训 定期体检 年终奖金 绩效奖金 生日福利 部门活动基金,2年经验,硕士,电子技术/半导体/集成电路
算法工程师（电子侦察方向）,成都能通科技股份有限公司,民营公司,1.5-3万/月,成都-武侯区,5,2021-09-29 17:45:21,五险一金 补充医疗保险 员工旅游 餐饮补贴 专业培训 定期体检 年终奖金 绩效奖金 生日福利 部门活动基金,3-4年经验,硕士,电子技术/半导体/集成电路
基带算法工程师,四川中电昆辰科技有限公司,创业公司,30-60万/年,成都,6,2021-09-29 13:57:42,五险一金 员工旅游 弹性工作 年终奖金 个人成长 员工食堂 绩效奖金,5-7年经验,硕士,电子技术/半导体/集成电路
语言算法工程师（NLP）,深圳天源迪科信息技术股份有限公司,民营公司,1-2万/月,成都,3,2021-09-27 14:03:30,定期体检 五险一金 年终奖金 周末双休 节日福利 上市公司 15薪,1年经验,本科,计算机软件
工程中心-运筹优化算法工程师,中国民用航空总局第二研究所,国企,10-15万/年,成都,10,2021-09-25 18:31:42,定期体检 周末双休 年终奖金 补充医疗保险 绩效奖金 五险一金 出国机会,无需经验,硕士,交通/运输/物流
深度学习算法加速工程师,湖南国科微电子股份有限公司,上市公司,2-4万/月,成都-高新区,4,2021-09-23 10:18:06,五险一金 补充医疗保险 补充公积金 绩效奖金 上市公司,2年经验,本科,电子技术/半导体/集成电路
校园招聘-ISP算法工程师,湖南国科微电子股份有限公司,上市公司,1-1.5万/月,成都-高新区,10,2021-09-23 10:18:06,五险一金 补充医疗保险 补充公积金 绩效奖金 定期体检,无需经验,本科,电子技术/半导体/集成电路
校园招聘-ISP算法工程师,湖南国科微电子股份有限公司,上市公司,1-1.5万/月,成都-高新区,10,2021-09-23 10:18:06,五险一金 补充医疗保险 补充公积金 绩效奖金 定期体检,无需经验,本科,电子技术/半导体/集成电路
高级图像算法工程师（ISP）,湖南国科微电子股份有限公司,上市公司,2-4万/月,成都-高新区,4,2021-09-23 10:18:05,五险一金 补充医疗保险 补充公积金 绩效奖金 上市公司,2年经验,本科,电子技术/半导体/集成电路
深度学习算法加速工程师,湖南国科微电子股份有限公司,上市公司,2-4万/月,深圳,4,2021-09-23 10:18:01,五险一金 补充医疗保险 补充公积金 绩效奖金 上市公司,2年经验,本科,电子技术/半导体/集成电路
惯性导航算法工程师,成都天合世纪科技有限责任公司,民营公司,1-1.5万/月,成都-高新区,10,2021-09-07 10:04:38,五险一金 通讯补贴 交通补贴 年终奖金,无需经验,本科,电子技术/半导体/集成电路
人工智能专家,四川伯乐帮科技有限公司,民营公司,3-6万/月,成都-龙泉驿区,6,2021-10-26 11:26:45,员工旅游 弹性工作 绩效奖金,5-7年经验,本科,互联网/电子商务
卫星姿轨控系统专家,四川伯乐帮科技有限公司,民营公司,2.5-5万/月,成都-高新区,5,2021-10-26 11:25:10,员工旅游 弹性工作 绩效奖金 五险一金 年终奖金,3-4年经验,本科,互联网/电子商务
三维图形算法研究员,四川伯乐帮科技有限公司,民营公司,2-4万/月,成都-高新区,5,2021-10-26 11:20:45,周末双休 弹性工作 氛围好,3-4年经验,硕士,互联网/电子商务
ASR工程师(J10186),深圳市普渡科技有限公司,民营公司,2.5-4万/月,深圳,5,2021-10-26 10:03:01,,3-4年经验,本科,计算机硬件
TTS工程师(J10117),深圳市普渡科技有限公司,民营公司,2.5-4万/月,深圳,5,2021-10-26 10:03:01,,3-4年经验,本科,计算机硬件
高性能算子库开发工程师(J10422),深圳云天励飞技术有限公司,民营公司,3-4万/月,成都-双流区,6,2021-10-26 10:02:50,年终奖金 六险一金 定期体检 餐饮补贴,5-7年经验,本科,计算机软件
图像识别工程师,四川东方水利智能装备工程股份有限公司,民营公司,0.8-1.5万/月,成都-成华区,4,2021-10-26 09:22:11,五险一金 补充医疗保险 交通补贴 年终奖金 绩效奖金 餐饮补贴 专业培训,2年经验,本科,机械/设备/重工
深度学习工程师-视觉方向,四川深瑞视科技有限公司,创业公司,1-3万/月,成都-武侯区,4,2021-10-26 09:00:07,周末双休 下午茶 节日福利,2年经验,硕士,计算机软件
Digital RAN Algorithm,Ericsson (China) Communications Co.LTD 爱立信（中国）通信有限公司,外资（欧美）,1.5-3万/月,成都-高新区,10,2021-10-26 07:00:13,五险一金 弹性工作 补充医疗保险 专业培训 定期体检,无需经验,本科,通信/电信/网络设备
图像处理部负责人,广州辰创科技发展有限公司,民营公司,1.8-2.6万/月,成都-金牛区,5,2021-10-25 15:00:01,,3-4年经验,硕士,通信/电信/网络设备
机器视觉开发工程师,成都术有云视觉科技有限公司,民营公司,15-20万/年,成都-高新区,3,2021-10-24 17:25:38,,1年经验,本科,仪器仪表/工业自动化
通信算法技术负责人,成都众享天地网络科技有限公司,民营公司,1.5-3万/月,成都-郫都区,3,2021-10-22 09:39:15,员工旅游 交通补贴 餐饮补贴 绩效奖金 年终奖金 弹性工作 五险一金 定期体检,1年经验,硕士,计算机软件
决策优化算法设计师,境观智能科技（成都）有限公司,民营公司,30-40万/年,成都-高新区,3,2021-10-20 11:32:34,,1年经验,博士,环保
AI算法部署专家-成都-G00208,沐曦集成电路（上海）有限公司,民营公司,2.5-4万/月,成都-高新区,6,2021-10-19 10:00:55,五险一金 绩效奖金 年终奖金 弹性工作 定期体检 补充医疗保险,5-7年经验,本科,电子技术/半导体/集成电路
控制工程师,天津大学四川创新研究院,事业单位,1-2万/月,成都-天府新区,5,2021-10-18 17:08:14,五险一金 员工旅游 专业培训 年终奖金 定期体检,3-4年经验,硕士,电子技术/半导体/集成电路
图像识别工程师（人工智能）,四川众合智控科技有限公司,民营公司,0.8-1.3万/月,成都-金牛区,3,2021-09-27 08:35:32,五险一金 带薪年假 节日福利 餐饮补贴 通讯补贴 高温补贴,1年经验,本科,电子技术/半导体/集成电路
工程中心-图像识别工程师,中国民用航空总局第二研究所,国企,10-15万/年,成都,10,2021-09-25 18:31:42,年终奖金 绩效奖金 专业培训 定期体检 补充医疗保险 五险,无需经验,硕士,交通/运输/物流
算法专家（CV）,成都圭目机器人有限公司,民营公司,2.5-5万/月,成都-龙泉驿区,6,2021-09-22 17:32:44,五险一金 补充医疗保险 员工旅游 定期体检 股票期权 餐饮补贴 年终奖金 绩效奖金 交通补贴,5-7年经验,硕士,计算机软件
视觉工程师,成都数之联科技有限公司,民营公司,0.8-1.2万/月,成都-高新区,4,2021-09-13 11:29:40,五险一金 员工旅游 交通补贴 餐饮补贴 年终奖金 绩效奖金 定期体检 弹性工作 专业培训,2年经验,本科,计算机软件
计算机视觉工程师,成都通甲优博科技有限责任公司,民营公司,1-2万/月,成都-双流区,4,2021-08-30 11:48:05,五险一金 餐饮补贴 定期体检 绩效奖金 年终奖金 股票期权 交通补贴 员工旅游,2年经验,本科,计算机软件
大数据算法工程师,成都国铁电气设备有限公司,民营公司,15-28万/年,成都-双流区,5,2021-10-26 15:38:20,五险一金 交通补贴 年终奖金 免费工作餐,3-4年经验,硕士,电子技术/半导体/集成电路
大数据算法工程师,成都思腾数联信息技术有限公司,外资（欧美）,1.5-2.5万/月,成都-高新区,6,2021-10-26 11:59:19,五险一金 补充公积金 绩效奖金 交通补贴 餐饮补贴 弹性工作 年终奖金 通讯补贴,5-7年经验,本科,计算机软件
C++开发工程师(算法应用方向),四川弘和集团,民营公司,1.5-2.5万/月,成都-武侯区,5,2021-10-26 10:09:13,周末双休 绩效奖金 餐饮补贴 五险一金,3-4年经验,本科,计算机软件
算法应用工程师,四川弘和集团,民营公司,1.2-2.5万/月,成都-武侯区,5,2021-10-26 10:09:13,五险一金 餐饮补贴 绩效奖金 交通补贴 股票期权 弹性工作 通讯补贴,3-4年经验,本科,计算机软件
音频算法工程师,深圳市长丰影像器材有限公司,民营公司,1.5-3万/月,成都-高新区,3,2021-10-26 09:30:53,五险一金 员工旅游 定期体检 年终奖金 加班补助 节日福利 绩效奖金,1年经验,本科,电子技术/半导体/集成电路
算法测试工程师,成都思晗科技股份有限公司,民营公司,0.6-1.2万/月,成都-高新区,3,2021-10-26 09:17:59,五险一金 定期体检 绩效奖金 专业培训 年终奖金,1年经验,本科,计算机软件
FPGA工程师（算法实现）,先临三维科技股份有限公司,上市公司,2-3万/月,成都,6,2021-10-26 09:06:56,餐饮补贴 交通补贴 年终奖金 员工旅游 带薪年假 五险一金,5-7年经验,本科,仪器仪表/工业自动化
图像算法及应用工程师,北京优创新港科技股份有限公司绵阳分公司,民营公司,1.3-2.2万/月,成都,4,2021-10-23 09:19:03,五险一金 弹性工作 年终奖金 绩效奖金 交通补贴 通讯补贴 餐饮补贴,2年经验,本科,计算机软件
算法经理/高级工程师（3D),深圳市东正光学技术有限公司,民营公司,20-30万/年,成都-郫都区,7,2021-10-22 21:27:59,员工旅游 交通补贴 餐饮补贴 通讯补贴 绩效奖金 年终奖金 股票期权,8-9年经验,硕士,仪器仪表/工业自动化
软件工程师(算法/信号处理),成都爱科特科技发展有限公司,上市公司,1-2万/月,成都-青羊区,5,2021-10-08 10:21:06,五险一金 餐饮补贴 年终奖金,3-4年经验,本科,电子技术/半导体/集成电路
视频编解码算法高级工程师,湖南国科微电子股份有限公司,上市公司,2-4万/月,成都-高新区,4,2021-09-23 10:18:05,五险一金 补充医疗保险 补充公积金 绩效奖金 上市公司,2年经验,本科,电子技术/半导体/集成电路
深度学习应用算法工程师,上海登临科技有限公司,合资,15-60万/年,成都-高新区,3,2021-09-07 16:41:34,五险一金 补充医疗保险 交通补贴 餐饮补贴 通讯补贴 专业培训 年终奖金 股票期权 弹性工作 定期体检,1年经验,本科,计算机硬件
数据标注主管,四川弘和集团,民营公司,5-7千/月,成都-武侯区,5,2021-10-26 10:13:21,周末双休 带薪年假 五险一金,3-4年经验,大专,计算机软件
嵌入式开发工程师,上海霍塔浩福自动化测试技术有限公司,外资（欧美）,1-2万/月,上海,5,2021-10-26 18:18:41,五险一金 免费班车,3-4年经验,本科,汽车
健康管理（PHM）工程师,北京航天测控技术有限公司,国企,20-28万/年,成都-成华区,4,2021-10-26 17:32:23,五险一金 全额基数 公积金12 加班少 带薪年假 高额出差补贴 试用期全额 工作自主性高,2年经验,硕士,仪器仪表/工业自动化
雷达对抗总体工程师,成都盟升电子技术股份有限公司,上市公司,2.5-5万/月,成都,5,2021-10-26 16:03:31,带薪年假 五险一金 节日福利 餐饮补贴 节日红包,3-4年经验,硕士,电子技术/半导体/集成电路
FPGA工程师-成都、绵阳,四川九洲防控科技有限责任公司,国企,12-24万/年,成都-高新区,4,2021-10-26 14:32:06,交通补贴 餐饮补贴 绩效奖金 定期体检 带薪年休 生日福利 五险两金,2年经验,本科,电子技术/半导体/集成电路
系统工程师,深圳市玖合鑫科技发展有限公司,民营公司,2.5-3万/月,深圳,3,2021-10-26 13:12:13,,1年经验,本科,通信/电信运营、增值服务
信号处理工程师,成都大公博创信息技术有限公司,民营公司,1.2-2万/月,成都,4,2021-10-26 10:37:24,五险一金 交通补贴 餐饮补贴 通讯补贴 年终奖金,2年经验,本科,通信/电信/网络设备
数据部主管,四川弘和集团,民营公司,4.5-6千/月,成都-武侯区,5,2021-10-26 10:09:13,周末双休 带薪年假 五险一金 股票期权 绩效奖金 餐饮补贴 交通补贴 通讯补贴 专业培训,3-4年经验,招1人,计算机软件
Linux C/C++信号处理工程师,电信科学技术第五研究所有限公司,国企,1-1.2万/月,成都,4,2021-10-26 09:41:53,五险一金 商业意外保险 企业年金 绩效奖金 年终奖金 定期体检 专业培训 餐饮补贴 周末双休 年底双薪,2年经验,本科,通信/电信/网络设备
