职位名字,公司名字,公司类型,薪资,地区,工作年限,发布日期,福利,经验,学历,所属行业
机器/深度学习算法工程师,上海通办信息服务有限公司,民营公司,1.2-2.2万/月,成都-高新区,3,2021-09-27 16:08:37,,1年经验,本科,计算机软件
定位算法工程师,深圳天源迪科信息技术股份有限公司,民营公司,1.5-4万/月,成都,3,2021-09-27 14:03:31,定期体检 五险一金 年终奖金 周末双休 节日福利 上市公司 15薪,1年经验,硕士,计算机软件
算法高级工程师,成都先导药物开发股份有限公司,合资,1.8-3万/月,成都,4,2021-09-27 13:59:57,五险一金 交通补贴 餐饮补贴 专业培训 绩效奖金 年终奖金 股票期权 定期体检,2年经验,博士,制药/生物工程
软件算法工程师,上海安路信息科技股份有限公司,民营公司,2-3.5万/月,成都-高新区,4,2021-09-27 09:39:41,五险一金 员工旅游 专业培训 年终奖金 股票期权 弹性工作,2年经验,硕士,电子技术/半导体/集成电路
机器视觉算法工程师,成都姜业光电科技有限公司,民营公司,20-30万/年,成都-天府新区,3,2021-09-26 18:08:21,五险一金 周末双休 绩效奖金 年终奖金 定期体检 朝九晚五点半 员工旅游 加班调休,1年经验,博士,机械/设备/重工
遥感算法工程师-地图慧,北京超图软件股份有限公司,上市公司,1.5-2万/月,成都-双流区,5,2021-09-26 16:00:01,五险一金 补充医疗保险 股票期权 交通补贴 通讯补贴 专业培训,3-4年经验,本科,计算机软件
图像算法工程师,成都天鹰锐视科技有限公司,民营公司,1-1.5万/月,成都-高新区,10,2021-09-24 14:13:01,周末双休 弹性工作 五险一金 14薪 节假日福利,无需经验,本科,计算机硬件
算法工程师（通信方向）,北京德辰科技股份有限公司,民营公司,1-1.5万/月,成都-高新区,5,2021-09-24 10:30:42,五险一金 餐饮补贴 交通补贴 带薪年假 员工旅游 绩效奖金 国内外旅游 专业培训 定期体检 项目奖金,3-4年经验,本科,电子技术/半导体/集成电路
图形开发工程师/算法工程师（工程事业部）,中国铁道科学研究院电子计算技术研究所,国企,1-2万/月,成都-武侯区,10,2021-09-23 19:22:39,五险一金 年终奖金 定期体检 带薪年假,无需经验,硕士,计算机软件
图像算法工程师,成都圭目机器人有限公司,民营公司,1.5-2.5万/月,成都-龙泉驿区,5,2021-09-22 17:32:44,五险一金 补充医疗保险 员工旅游 定期体检 股票期权 餐饮补贴 年终奖金 绩效奖金 交通补贴,3-4年经验,硕士,计算机软件
图像算法工程师,北京卓视智通科技有限责任公司,民营公司,0.9-2万/月,成都-武侯区,3,2021-09-22 11:09:04,五险一金 绩效奖金 年终奖金 弹性工作,1年经验,本科,计算机软件
算法工程师,深圳市维新教育科技有限公司,民营公司,2-2.5万/月,成都-武侯区,4,2021-09-22 07:09:27,五险一金 绩效奖金 全勤奖 节日福利 专业培训 员工旅游,2年经验,硕士,专业服务(咨询、人力资源、财会)
视觉算法工程师,成都指码科技有限公司,创业公司,1-1.8万/月,成都,4,2021-09-20 16:00:01,五险一金 餐饮补贴 绩效奖金 年终奖金,2年经验,本科,仪器仪表/工业自动化
无线通讯算法工程师,大摩智讯科技（宁波）有限责任公司,民营公司,1-2.5万/月,宁波,4,2021-09-17 16:00:01,,2年经验,硕士,通信/电信/网络设备
算法工程师,成都乐享智家科技有限责任公司,民营公司,0.8-1.3万/月,成都-高新区,5,2021-09-17 09:00:01,五险一金 绩效奖金 定期体检 年终奖金 弹性工作 专业培训 周末双休 补充医疗保险,3-4年经验,本科,计算机软件
算法仿真工程师/系统工程师,成都靖尧通信技术有限公司,民营公司,1-2.5万/月,成都-成华区,4,2021-09-15 13:55:16,五险一金 补充医疗保险 员工旅游 年终奖金 弹性工作 餐饮补贴,2年经验,硕士,通信/电信/网络设备
信号处理算法工程师,成都点阵科技有限公司,民营公司,1-2万/月,成都,4,2021-09-13 15:00:01,五险一金 交通补贴 餐饮补贴 通讯补贴 年终奖金 定期体检,2年经验,本科,电子技术/半导体/集成电路
算法工程师,成都市安比科技有限公司,民营公司,30-50万/年,成都-高新区,5,2021-09-13 10:06:40,,3-4年经验,本科,电子技术/半导体/集成电路
图像算法工程师,深圳市置辰海信科技有限公司四川分公司,民营公司,1.2-1.8万/月,成都-武侯区,5,2021-09-13 08:56:03,五险一金 员工旅游 补充医疗保险 绩效奖金 弹性工作,3-4年经验,本科,计算机软件
组合导航算法工程师,成都天合世纪科技有限责任公司,民营公司,1.5-2万/月,成都-高新区,3,2021-09-11 10:00:01,五险一金 通讯补贴 交通补贴 年终奖金,1年经验,本科,电子技术/半导体/集成电路
视觉算法工程师,成都欣明科技有限公司,创业公司,1-2万/月,成都,4,2021-09-08 13:32:22,五险一金 通讯补贴 绩效奖金 年终奖金 定期体检 交通补贴 商业保险,2年经验,本科,仪器仪表/工业自动化
算法分析与设计工程师,上海登临科技有限公司,合资,16-60万/年,成都-高新区,4,2021-09-07 16:41:34,补充医疗保险 员工旅游 交通补贴 餐饮补贴 通讯补贴 股票期权 年终奖金 弹性工作 六险一金 定期体检,2年经验,硕士,计算机硬件
算法（数据）工程师,四川川润股份有限公司,民营公司,1-1.5万/月,成都-高新区,4,2021-09-06 19:00:43,五险一金 节日福利 周末双休 带薪年假 免费工作餐,2年经验,大专,机械/设备/重工
算法工程师,四川创智联恒科技有限公司,上市公司,2.2-4.5万/月,成都-高新区,6,2021-09-03 04:01:31,周末双休 带薪年假 五险一金 交通补贴 餐饮补贴 通讯补贴,5-7年经验,本科,通信/电信/网络设备
AI算法工程师,中电万维信息技术有限责任公司,国企,1-1.5万/月,成都-高新区,3,2021-09-02 18:26:16,五险一金 专业培训 年终奖金 防暑费 通讯补贴 餐饮补贴 带薪年假 补充医疗保险 绩效奖金 定期体检,1年经验,硕士,计算机软件
图像算法工程师,成都鼎屹信息技术有限公司,民营公司,1.3-2.2万/月,成都-高新区,5,2021-09-01 09:32:55,五险一金 专业培训 年终奖金 项目奖励 定期体检 交通补贴 通讯补贴 带薪年假,3-4年经验,本科,电子技术/半导体/集成电路
信号处理算法工程师,成都深地领航能源科技有限公司,民营公司,1.8-3万/月,成都-新都区,6,2021-08-31 10:10:48,餐饮补贴 定期体检 绩效奖金 年终奖金 租房补贴 加班补贴,5-7年经验,本科,仪器仪表/工业自动化
雷达算法工程师,成都雷通科技有限公司,民营公司,1.5-3万/月,成都-高新区,5,2021-08-30 13:45:05,餐饮补贴 专业培训 出国机会 绩效奖金 年终奖金 五险一金,3-4年经验,本科,电子技术/半导体/集成电路
图像算法工程师,北京鼎汉技术集团股份有限公司,上市公司,1-1.5万/月,成都-高新区,4,2021-08-30 13:09:59,,2年经验,本科,仪器仪表/工业自动化
深度学习算法工程师,成都通甲优博科技有限责任公司,民营公司,1.5-3万/月,成都-双流区,4,2021-08-30 11:48:05,五险一金 餐饮补贴 定期体检 绩效奖金 年终奖金 股票期权 交通补贴 员工旅游,2年经验,本科,计算机软件
图形图像算法工程师（成都）,成都东方盛行电子有限责任公司,民营公司,1.5-2万/月,四川省,4,2021-08-30 11:35:08,五险一金 餐饮补贴 交通补贴 绩效奖金 年终奖金 定期体检,2年经验,硕士,计算机软件
机器学习算法工程师,广州多益网络股份有限公司,民营公司,1.2-2.4万/月,成都-高新区,10,2021-08-30 09:15:09,互联网百强,无需经验,招若干人,网络游戏
AI算法工程师 （高频量化交易方向）,抚州链视角互联网科技有限公司,民营公司,1.2-2万/月,抚州,5,2021-08-28 09:00:28,五险一金 员工旅游 专业培训 年终奖金 弹性工作 法定假日,3-4年经验,本科,互联网/电子商务
软件工程师（成都）,新源动力股份有限公司,民营公司,0.8-1.5万/月,成都,3,2021-10-26 04:32:25,,1年经验,硕士,电气/电力/水利
数量遗传分析师,新希望六和股份有限公司,上市公司,1-1.8万/月,成都,3,2021-10-26 09:32:45,定期体检 绩效奖金 专业培训 节日福利 带薪年假 交通补贴 五险 包吃,1年经验,本科,农/林/牧/渔
FPGA算法逻辑开发人员,成都睿志辰科技有限公司,民营公司,1.5-2.5万/月,成都-武侯区,4,2021-10-26 09:11:52,五险一金,2年经验,本科,通信/电信/网络设备
自动化、视觉工程师,成都三行科技有限公司,民营公司,0.8-1.3万/月,成都-金牛区,10,2021-10-26 08:56:33,员工旅游 通讯补贴 年终奖金 定期体检 周末双休 节假日福利 五险一金,无需经验,大专,仪器仪表/工业自动化
机器视觉开发工程师,四川聚能峰科技有限公司,民营公司,1-2万/月,成都-金牛区,5,2021-10-26 04:01:15,交通补贴 通讯补贴 年终奖金 周末双休 入职购买社保 节日福利,3-4年经验,大专,计算机软件
机器视觉应用工程师（成都+高底薪+项目奖+分红）,成都新得利电子有限公司,民营公司,0.8-1.5万/月,成都-武侯区,5,2021-10-26 04:00:00,五险一金 绩效奖金 年终奖金 股票期权 专业培训 员工旅游 餐饮补贴 出国机会 带薪年假 身股分红,3-4年经验,大专,计算机服务(系统、数据服务、维修)
ISP Algorithm Engineer,赛昉科技,外资（欧美）,2-5万/月,上海,6,2021-10-26 17:03:24,,5-7年经验,本科,电子技术/半导体/集成电路
算法研究员（信号处理方向）,成都今是科技有限公司,民营公司,3-4万/月,成都-高新区,5,2021-10-26 15:49:33,五险一金 周末双休 带薪年假 交通补贴 通讯补贴 节日福利 期权股票 年终奖金 绩效奖金 商业保险,3-4年经验,本科,医疗设备/器械
机器视觉工程师,四川国软科技集团有限公司,民营公司,0.6-1.2万/月,成都-金牛区,4,2021-10-26 12:09:12,五险一金 绩效奖金 年终奖金 弹性工作 周末双休,2年经验,本科,计算机服务(系统、数据服务、维修)
三维算法研究员,成都天佑智隧科技有限公司,民营公司,2-3.5万/月,成都-金牛区,4,2021-10-26 11:10:56,员工旅游 定期体检 弹性工作 年终奖金 六险一金 部门活动 生日会 节日礼品 专业培训 绩效奖金,2年经验,硕士,计算机服务(系统、数据服务、维修)
视觉工程师,征图新视（江苏）科技股份有限公司,民营公司,1-2万/月,成都,5,2021-10-26 09:42:58,五险一金 免费班车 员工旅游 通讯补贴 年终奖金 定期体检,3-4年经验,本科,仪器仪表/工业自动化
软件工程师,浙江新控路桥监测科技有限公司,民营公司,0.5-2万/月,成都-双流区,4,2021-10-26 09:27:55,,2年经验,本科,电子技术/半导体/集成电路
引擎优化工程师,新电信息科技（成都）有限公司,外资（非欧美）,1.2-2万/月,成都-高新区,7,2021-10-26 09:27:32,五险一金 绩效奖金 专业培训 弹性工作 补充医疗保险 出国机会,8-9年经验,本科,计算机软件
视觉工程师（成都）,厦门微亚智能科技有限公司,民营公司,0.8-1万/月,成都-龙泉驿区,5,2021-10-26 09:09:58,五险一金 带薪年假,3-4年经验,大专,仪器仪表/工业自动化
高级数据挖掘工程师,亚信科技CMC,合资,1.2-2.2万/月,成都-高新区,5,2021-10-26 07:00:32,五险一金 通讯补贴 绩效奖金 定期体检 年底双薪 餐补 带薪年假,3-4年经验,本科,计算机软件
AI工程师（数据挖掘）,电信事业部,外资（欧美）,1.5-2.5万/月,成都-高新区,5,2021-10-26 07:00:28,五险一金 补充医疗保险 通讯补贴 绩效奖金 年终奖金 定期体检 弹性工作,3-4年经验,本科,通信/电信运营、增值服务
视觉工程师,成都秦川物联网科技股份有限公司,上市公司,0.8-1.5万/月,成都-龙泉驿区,5,2021-10-25 09:15:12,五险一金 绩效奖金 年终奖金 专业培训 免费班车 通讯补贴 交通补贴 周末双休,3-4年经验,本科,仪器仪表/工业自动化
算法设计师,成都迈瑞企业管理咨询有限公司,民营公司,1.8-2.3万/月,成都-锦江区,6,2021-10-25 09:00:49,五险一金 年终奖金,5-7年经验,本科,计算机软件
NLP工程师,北京融数易雨科技有限公司,民营公司,1-1.5万/月,成都,5,2021-10-22 14:00:36,,3-4年经验,本科,计算机软件
视觉工程师（成都）(J10570),江苏创源电子有限公司,民营公司,1-1.5万/月,四川省,4,2021-10-22 08:25:29,五险一金 包住宿 绩效奖金 节日福利 员工旅游 年终奖金,2年经验,大专,仪器仪表/工业自动化
机器学习工程师,四川九强通信科技有限公司,国企,0.6-1.5万/月,成都-武侯区,3,2021-10-21 17:52:02,五险一金 绩效奖金 年终奖金 交通补贴 餐饮补贴 通讯补贴 专业培训,1年经验,大专,通信/电信/网络设备
流体力学工程师,成都铭峰新源科技有限公司,民营公司,1-1.5万/月,成都-高新区,3,2021-10-21 14:13:38,五险一金 员工旅游 专业培训 定期体检 年终奖金 绩效奖金 补充医疗保险,1年经验,本科,计算机软件
图像识别工程师,四川众合智控科技有限公司,民营公司,0.6-1.3万/月,成都-金牛区,3,2021-10-21 13:32:12,五险一金 带薪年假 节日福利 餐饮补贴 通讯补贴 高温补贴,1年经验,大专,电子技术/半导体/集成电路
AI工程师(数据挖掘）,四川天上友嘉网络科技有限公司,民营公司,2-4万/月,成都,5,2021-10-20 16:13:27,五险一金 年终奖金 员工餐 带薪年假 节日福利,3-4年经验,硕士,网络游戏
AI工程师,松翰科技（成都）有限公司,外资（非欧美）,0.8-2万/月,成都-高新区,10,2021-10-20 14:45:20,五险一金 员工旅游 餐饮补贴 绩效奖金 年终奖金 补充医疗保险,无需经验,本科,电子技术/半导体/集成电路
图像处理/显示/视频编解码ASIC设计工程师,翱捷科技（上海）有限公司,合资,,成都,4,2021-10-20 10:24:59,补充公积金 补充医疗保险 五险一金 餐饮补贴 弹性工作 定期体检,2年经验,硕士,电子技术/半导体/集成电路
人工智能算法开发专家-成都-G00259,沐曦集成电路（上海）有限公司,民营公司,2.4-4万/月,成都-高新区,6,2021-10-19 10:00:55,五险一金 绩效奖金 年终奖金 弹性工作 定期体检 补充医疗保险,5-7年经验,本科,电子技术/半导体/集成电路
搜索引擎开发工程师,四川奥特而科技有限公司,民营公司,0.8-1.6万/月,成都-武侯区,5,2021-10-17 15:33:16,五险一金 绩效奖金 年终奖金 节日福利 股票期权 弹性工作,3-4年经验,本科,仪器仪表/工业自动化
视觉工程师,TCL王牌电器（成都）有限公司,合资,0.8-1.8万/月,成都-郫都区,4,2021-10-16 09:25:02,五险一金 员工旅游 餐饮补贴 专业培训 绩效奖金 年终奖金 定期体检,2年经验,本科,家具/家电/玩具/礼品
CCD视觉工程师,捷普集团-捷普科技（成都）有限公司,外资（欧美）,1-1.5万/月,成都,5,2021-10-15 11:49:37,五险一金 定期体检 年终奖金 专业培训 免费班车 餐饮补贴 绩效奖金,3-4年经验,本科,多元化业务集团公司
机器视觉工程师,成都航视自动化技术有限公司,民营公司,0.6-1.2万/月,成都-郫都区,5,2021-10-09 17:02:14,五险一金 员工旅游 餐饮补贴 专业培训 绩效奖金 年终奖金 定期体检 节日福利 团队聚餐,3-4年经验,大专,计算机软件
AI人工智能工程师,成都翼比特自动化设备有限公司,民营公司,1.5-2万/月,成都-高新区,4,2021-09-27 09:02:10,五险一金 周末双休 带薪年假 节日福利,2年经验,本科,电气/电力/水利
视觉工程师,成都数之联科技有限公司,民营公司,1.5-2万/月,成都-高新区,6,2021-09-24 17:26:01,五险一金 员工旅游 交通补贴 餐饮补贴 年终奖金 绩效奖金 定期体检 弹性工作 专业培训,5-7年经验,本科,计算机软件
ROS软件开发工程师,成都越凡创新科技有限公司,民营公司,1.2-1.7万/月,成都-郫都区,4,2021-09-22 18:13:10,五险一金 年终奖金 绩效奖金,2年经验,本科,计算机软件
图像识别工程师,四川柯普农业咨询有限责任公司,民营公司,1.5-2.4万/月,成都-高新区,3,2021-09-22 18:12:21,入职五险一金 补充医疗保险 年终奖金 节日福利 生日福利,1年经验,本科,农/林/牧/渔
机器人软件工程师,成都市鹰诺实业有限公司,合资,0.6-1万/月,成都-崇州市,3,2021-09-17 08:47:47,带薪年假 五险一金 包吃 包住宿 专业培训 餐饮补贴 加班补贴 住房补贴,1年经验,本科,仪器仪表/工业自动化
视觉工程师,成都宏明双新科技股份有限公司,国企,1.4-1.8万/月,成都,6,2021-09-02 08:10:57,五险一金 年终奖金 员工旅游 定期体检 餐饮补贴 专业培训 绩效奖金 住宿 带薪年假 免费班车,5-7年经验,本科,电子技术/半导体/集成电路
算法设计师（研究院成都研究所）,广州海格通信集团股份有限公司,国企,1.5-2.5万/月,成都-武侯区,5,2021-08-28 13:35:38,五险一金 补充医疗保险 餐饮补贴 专业培训 绩效奖金 年终奖金 定期体检 员工旅游 免费班车 交通补贴,3-4年经验,硕士,通信/电信/网络设备
算法工程师（V2X/ADAS仿真测试方向）,信通院车联网创新中心（成都）有限公司,国企,1.5-2.5万/月,成都-龙泉驿区,5,2021-10-26 13:25:53,,3-4年经验,硕士,汽车
算法应用工程师,保华微电子有限公司,国企,1.5-2.5万/月,成都-武侯区,5,2021-10-26 15:59:07,五险一金 弹性工作 专业培训,3-4年经验,硕士,计算机软件
Python算法工程师双休,四川顶牛人力资源有限公司,民营公司,1.5-2.5万/月,成都-武侯区,5,2021-10-26 10:04:50,五险一金 弹性工作 专业培训 年终奖金 员工旅游 定期体检 绩效奖金,3-4年经验,大专,计算机软件
高级音频算法工程师,深圳市长丰影像器材有限公司,民营公司,2-3.5万/月,成都-高新区,5,2021-10-26 09:30:53,五险一金 员工旅游 定期体检 年终奖金 加班补助 节日福利 绩效奖金,3-4年经验,本科,电子技术/半导体/集成电路
音频算法工程师,成都汇声科技有限公司,民营公司,1-1.6万/月,成都-高新区,5,2021-10-26 09:15:39,五险一金 员工旅游 交通补贴 餐饮补贴 绩效奖金 年终奖金 弹性工作,3-4年经验,本科,医疗设备/器械
视频算法工程师（高级）,安睿智达（成都）科技有限公司,国企,1.5-3万/月,成都-武侯区,5,2021-10-25 09:13:35,五险一金 交通补贴 定期体检 餐饮补贴 绩效奖金 通讯补贴 住房补贴 周末双休 年终奖金 生日津贴,3-4年经验,硕士,计算机软件
图像算法及应用工程师,北京优创新港科技股份有限公司绵阳分公司,民营公司,1.5-2万/月,成都,3,2021-10-23 09:19:09,五险一金 弹性工作 年终奖金 绩效奖金 交通补贴 通讯补贴 餐饮补贴,1年经验,硕士,计算机软件
算法工程师（V2X/ADAS仿真测试方向）,中外联（成都）人力资源管理有限公司,民营公司,1.5-2.5万/月,成都-龙泉驿区,5,2021-10-22 11:39:08,五险一金 绩效奖金 年终奖金,3-4年经验,硕士,专业服务(咨询、人力资源、财会)
FPGA工程师,成都国翼电子技术有限公司,上市公司,1.5-2万/月,成都-高新区,5,2021-10-26 17:05:46,五险一金 补充医疗保险 年终奖金 专业培训 定期体检 餐饮补贴,3-4年经验,本科,航天/航空
量化算法研究员,西安迈科能源有限责任公司,民营公司,1-1.5万/月,成都-武侯区,3,2021-10-26 17:00:01,五险一金 年终奖金 周末双休 优厚福利 丰富团建 广阔晋升空间 补充医疗保险 交通补贴 通讯补贴,1年经验,硕士,金融/投资/证券
FPGA工程师,四川惟景科技有限公司,民营公司,1.8-3.5万/月,成都-高新区,5,2021-10-26 16:13:37,五险一金 餐饮补贴 专业培训 绩效奖金 年终奖金 定期体检,3-4年经验,本科,通信/电信运营、增值服务
FPGA工程师,四川六九一二通信技术股份有限公司,民营公司,1.5-3万/月,成都-高新区,5,2021-10-26 15:43:57,五险一金 餐饮补贴 专业培训 绩效奖金 年终奖金 定期体检,3-4年经验,本科,通信/电信/网络设备
信号处理工程师,桂林长海发展有限责任公司,国企,15-20万/年,成都-成华区,10,2021-10-26 14:32:40,五险一金 员工旅游 交通补贴 餐饮补贴 通讯补贴 专业培训 出国机会 绩效奖金 年终奖金 定期体检,无需经验,本科,电子技术/半导体/集成电路
信号处理工程师,湖南华诺星空电子技术有限公司,民营公司,0.8-1.5万/月,成都-郫都区,10,2021-10-26 11:17:03,五险一金 员工旅游 餐饮补贴 年终奖金 定期体检 周末双休 婚育礼金 专业培训 绩效奖金,无需经验,本科,电子技术/半导体/集成电路
高级机器人工程师,成都博恩思医学机器人有限公司,民营公司,1.5-2.5万/月,成都-高新区,5,2021-10-26 10:10:59,五险一金 餐饮补贴 年终奖金 节日福利 专业培训 出国机会 绩效奖金 股票期权 顶尖团队 员工旅游,3-4年经验,本科,医疗设备/器械
计算机视觉研究员,深圳市中钞信达金融科技有限公司,国企,1.3-2.5万/月,成都-高新区,4,2021-10-26 09:50:06,五险一金 交通补贴 餐饮补贴 年终奖金 绩效奖金 定期体检,2年经验,本科,计算机软件
大数据工程师,清能艾科（深圳）能源技术有限公司,创业公司,1-1.8万/月,深圳,4,2021-10-26 09:33:18,五险一金 周末双休 年终奖金 绩效奖金 发展空间大 福利待遇优,2年经验,本科,石油/化工/矿产/地质
信号处理工程师,无锡鸣石峻致医疗科技有限公司,民营公司,1.5-3万/月,成都-高新区,10,2021-10-26 08:42:13,五险一金 员工旅游 交通补贴 餐饮补贴 专业培训 绩效奖金 年终奖金 股票期权 弹性工作 定期体检,无需经验,本科,医疗/护理/卫生
Python少儿编程老师,成都熊猫编程教育科技有限公司,民营公司,0.8-1万/月,成都-青羊区,3,2021-10-25 14:44:11,,1年经验,本科,教育/培训/院校
嵌入式软件工程师-成都003,杭州雄迈集成电路技术股份有限公司,民营公司,0.6-1.3万/月,成都-高新区,3,2021-10-23 17:31:51,五险一金 绩效奖金 定期体检 餐饮补贴 员工旅游 股票期权 专业培训 年终奖金,1年经验,本科,电子技术/半导体/集成电路
高级数字信号处理工程师,成都创亿嘉科技有限公司,民营公司,1.6-3万/月,成都-武侯区,5,2021-10-23 10:00:01,五险一金 员工旅游 交通补贴 餐饮补贴 通讯补贴 专业培训 绩效奖金 年终奖金 股票期权 定期体检,3-4年经验,本科,电子技术/半导体/集成电路
电子系统级仿真工程师,北京京汇思维科技发展有限公司,外资（非欧美）,1-1.5万/月,成都-武侯区,,2021-10-22 13:49:44,五险一金 员工旅游 餐饮补贴 通讯补贴 绩效奖金 弹性工作 定期体检,招1人,,计算机软件
camera tuning调试,江苏超正科技有限公司,民营公司,1.4-2.7万/月,成都-高新区,5,2021-10-21 11:31:45,五险一金 周末双休 加班补贴 交通补贴 餐饮补贴,3-4年经验,大专,计算机软件
量化算法研究员-base 成都,交叉科技（北京）有限公司,民营公司,1-1.5万/月,成都-高新区,4,2021-10-20 11:27:56,五险一金 绩效奖金 年终奖金 股票期权 弹性工作 定期体检,2年经验,本科,计算机服务(系统、数据服务、维修)
ASIC高级开发工程师（5G基带）,白盒子（上海）微电子科技有限公司,民营公司,2.5-5万/月,成都-天府新区,8,2021-10-20 11:06:15,五险一金 股票期权 餐饮补贴 年终奖金,10年以上经验,本科,电子技术/半导体/集成电路
专利分析师（算法）,苏州七星天专利运营管理有限责任公司,合资,1-1.5万/月,成都-天府新区,10,2021-10-14 09:50:21,五险一金 定期体检 年终奖金 周末双休 在家办公 接收档案 可办集体户口 节日福利 弹性工作,无需经验,本科,专业服务(咨询、人力资源、财会)
C++软件开发工程师,北京华大九天科技股份有限公司,国企,0.7-1.2万/月,成都-双流区,,2021-10-13 11:00:02,五险一金 补充医疗保险 弹性工作 股票期权 绩效奖金 年终奖金 定期体检 餐饮补贴 交通补贴,本科,招5人,电子技术/半导体/集成电路
信号处理工程师,航天科工微系统技术有限公司,国企,20-50万/年,成都-成华区,5,2021-09-19 09:00:01,五险一金 交通补贴 餐饮补贴 通讯补贴 出国机会 绩效奖金 年终奖金 定期体检 高温补贴 节假生日福利,3-4年经验,硕士,航天/航空
科研合作专家(医疗AI)(J12042),上海联影智能医疗科技有限公司,民营公司,1.5-2.5万/月,成都-武侯区,4,2021-09-18 19:02:14,五险一金 补充医疗保险 年终奖金 绩效奖金 餐饮补贴 定期体检 员工旅游,2年经验,硕士,计算机软件
Python开发工程师（可转正）,成都鲲摇物联网有限责任公司,民营公司,3-4.5千/月,成都-武侯区,10,2021-09-02 08:55:37,五险一金 补充公积金 员工旅游 出国机会 定期体检 弹性工作 专业培训 绩效奖金 年终奖金 补充医疗保险,无需经验,招3人,互联网/电子商务
