职位名字,公司名字,公司类型,薪资,地区,工作年限,发布日期,福利,经验,学历,所属行业
广州-AI算法工程师（成都）,无锡路通视信网络股份有限公司,上市公司,0.8-1.6万/月,成都,1,2021-10-26 18:00:42,,在校生/应届生,硕士,通信/电信/网络设备
算法工程师（工作地：上海）（成都）,常州星宇车灯股份有限公司,上市公司,1-1.5万/月,成都,1,2021-10-26 10:02:29,,在校生/应届生,本科,汽车零配件
通信算法工程师(成都),杭州巨峰科技有限公司,民营公司,0.8-1.2万/月,成都,1,2021-10-26 05:35:09,,在校生/应届生,本科,计算机软件
机器学习/AI算法工程师,中国电子科技集团公司第十研究所,事业单位,1-1.5万/月,成都,1,2021-10-26 05:13:50,,在校生/应届生,硕士,电子技术/半导体/集成电路
算法工程师（工作地点：苏州）（成都）,苏州千机智能技术有限公司,民营公司,0.9-1.8万/月,成都,1,2021-10-26 05:13:12,,在校生/应届生,本科,仪器仪表/工业自动化
电机控制算法工程师（成都）,深圳市普渡科技有限公司,民营公司,1.5-3万/月,成都,1,2021-10-26 05:10:30,,在校生/应届生,本科,计算机硬件
AI算法工程师（成都）,上海联影医疗科技股份有限公司,民营公司,1.4-2.8万/月,成都,1,2021-10-26 05:01:16,,在校生/应届生,硕士,医疗设备/器械
导航算法工程师,成都国星通信有限公司,民营公司,1.3-1.7万/月,成都,1,2021-10-26 04:43:55,,在校生/应届生,硕士,通信/电信/网络设备
图像算法工程师,四川长虹电子控股集团有限公司,国企,1.5-2万/月,成都,1,2021-10-26 04:41:23,,在校生/应届生,硕士,电子技术/半导体/集成电路
视觉算法工程师,四川京炜交通工程技术有限公司,民营公司,6-8千/月,成都-高新区,1,2021-10-26 09:48:23,,在校生/应届生,硕士,检测，认证
NLP算法工程师（工作地：苏州、北京）（成都）,思必驰科技股份有限公司,民营公司,2-3万/月,成都,1,2021-10-26 04:01:52,,在校生/应届生,硕士,计算机软件
算法工程师（工作地：苏州）,苏州博古特智造有限公司,民营公司,1-1.5万/月,成都,1,2021-10-26 04:01:52,,在校生/应届生,硕士,机械/设备/重工
算法工程师,欧冶云商股份有限公司,国企,1.3-2.6万/月,成都,1,2021-10-26 04:01:52,,在校生/应届生,本科,多元化业务集团公司
深国电-AI算法工程师,深圳市国电科技通信有限公司,民营公司,1-1.4万/月,成都,1,2021-10-26 04:01:52,,在校生/应届生,硕士,通信/电信/网络设备
算法工程师（成都）,江苏满运软件科技有限公司,民营公司,1.5-3万/月,成都,1,2021-10-26 04:01:52,,在校生/应届生,本科,计算机软件
算法工程师-航天宏图（成都）,中关村空间信息产业技术联盟,民营公司,1-1.5万/月,成都,1,2021-10-26 04:01:52,,在校生/应届生,硕士,计算机软件
算法/建模工程师（成都）,中国航空工业集团公司上海航空测控技术研究所,国企,0.8-1万/月,成都,1,2021-10-26 04:01:52,,在校生/应届生,硕士,航天/航空
算法工程师（信号）,成都数之联科技有限公司,民营公司,1-1.5万/月,成都,1,2021-10-26 04:01:52,,在校生/应届生,硕士,计算机软件
算法设计工程师 — CAD图形引擎（成都）,深圳逍遥科技有限公司,民营公司,1.2-2.4万/月,成都,1,2021-10-26 10:07:42,,在校生/应届生,本科,电子技术/半导体/集成电路
算法工程师（成都）,中电鸿信信息科技有限公司,民营公司,0.8-1.2万/月,成都,1,2021-10-26 09:49:01,,在校生/应届生,本科,通信/电信/网络设备
AI算法工程师（苏州）,江苏风云科技服务有限公司,国企,0.8-1万/月,成都,1,2021-10-26 09:47:56,,在校生/应届生,本科,多元化业务集团公司
算法工程师（成都）,亚信科技(中国)有限公司,外资（欧美）,1-2万/月,成都,1,2021-10-26 09:34:10,,在校生/应届生,硕士,计算机软件
图像算法工程师（工作地西安）（成都）,西安因诺航空科技有限公司,民营公司,1.5-2.5万/月,成都,1,2021-10-26 04:01:52,,在校生/应届生,硕士,航天/航空
算法工程师,深圳市极致汇仪科技有限公司,民营公司,1-1.7万/月,成都,1,2021-10-26 04:01:52,,在校生/应届生,硕士,仪器仪表/工业自动化
多媒体算法工程师（成都）,翱捷科技股份有限公司,民营公司,1.5-3万/月,成都,1,2021-10-26 04:01:52,,在校生/应届生,硕士,电子技术/半导体/集成电路
数值算法工程师（成都）,苏州同元软控信息技术有限公司,民营公司,1-1.5万/月,成都,1,2021-10-26 04:01:52,,在校生/应届生,本科,计算机软件
高级算法工程师,广州精科医学检验所有限公司,民营公司,1.5-3万/月,成都-武侯区,1,2021-10-26 18:19:10,五险一金 专业培训 弹性工作 年终奖金 做五休二,在校生/应届生,硕士,医疗设备/器械
算法工程师,迈克生物股份有限公司,上市公司,0.8-1.2万/月,成都,1,2021-10-26 15:39:57,,在校生/应届生,本科,医疗设备/器械
运动控制算法工程师,成都熊谷加世电器有限公司,民营公司,15-20万/年,成都-郫都区,1,2021-10-26 13:12:55,带薪年假 五险一金 绩效奖金 全勤奖 节日福利 专业培训 交通补贴 加班补贴,在校生/应届生,硕士,机械/设备/重工
无线算法工程师（校招）,四川灵通电讯有限公司,国企,14-20万/年,绵阳,1,2021-10-26 12:01:35,五险一金 免费班车 交通补贴 定期体检 绩效奖金 年终奖金,在校生/应届生,硕士,电子技术/半导体/集成电路
算法工程师（应届）,成都瀚德科技有限公司,民营公司,3.5-6千/月,成都,1,2021-10-26 11:19:33,,在校生/应届生,硕士,通信/电信/网络设备
nlp算法工程师 (MJ001060),慧择网,上市公司,1-1.5万/月,成都-高新区,1,2021-10-26 09:09:50,,在校生/应届生,本科,互联网/电子商务
算法工程师,成都维客昕微电子有限公司,民营公司,10-18万/年,成都-高新区,1,2021-10-25 09:12:26,五险一金 交通补贴 餐饮补贴 通讯补贴 定期体检 员工旅游,在校生/应届生,本科,电子技术/半导体/集成电路
算法工程师（校招） (MJ000056),北京亚控科技发展有限公司,民营公司,1.2-2万/月,西安,1,2021-10-22 08:38:46,周末双休 带薪年假 五险一金 绩效奖金 节日福利 餐饮补贴,在校生/应届生,硕士,计算机软件
算法助理工程师,武汉能钠智能装备技术股份有限公司,民营公司,0.5-1万/月,成都-武侯区,1,2021-10-19 14:58:04,五险一金 年终奖金 定期体检 员工旅游 周末双休 绩效奖金,在校生/应届生,本科,计算机软件
旋翼无人机系统 飞行控制算法工程师,同方电子科技有限公司,国企,0.5-1.5万/月,九江,1,2021-10-18 14:29:56,五险一金 补充医疗保险 餐饮补贴 员工旅游 定期体检 年终奖金 绩效奖金 通讯补贴 住房补贴,在校生/应届生,本科,通信/电信/网络设备
算法工程师（视觉测量）,成都交大光芒科技股份有限公司,国企,1-1.5万/月,成都,1,2021-10-18 11:00:33,五险一金 带薪年假 绩效奖金 年终奖金 补充医疗保险 定期体检 餐饮补贴,在校生/应届生,本科,计算机服务(系统、数据服务、维修)
5G物理层算法工程师,锐捷网络股份有限公司,上市公司,1-1.5万/月,成都,1,2021-10-15 14:56:30,五险一金 交通补贴 餐饮补贴 专业培训 定期体检 年终奖金,在校生/应届生,硕士,通信/电信/网络设备
通信算法工程师（2022届硕士）,上海瀚讯信息技术股份有限公司,民营公司,20-40万/年,上海,1,2021-10-15 09:38:35,,在校生/应届生,硕士,计算机软件
通信信号算法研究工程师,成都新越盛和科技有限公司,民营公司,1-1.5万/月,成都-武侯区,1,2021-10-11 17:01:53,五险一金 年终奖金,在校生/应届生,本科,计算机软件
算法工程师（2022届校招）,兰亭集势,上市公司,0.9-1.5万/月,成都-高新区,1,2021-10-09 11:36:01,通讯补贴 专业培训 弹性工作 五险一金 扁平化管理 领导NICE,在校生/应届生,本科,互联网/电子商务
媒体算法工程师-武汉/成都/北京,北京小鱼易连科技有限公司,合资,0.8-1.5万/月,成都-武侯区,1,2021-09-13 17:00:01,五险一金 餐饮补贴 通讯补贴 年终奖金 弹性工作 定期体检 节日福利,在校生/应届生,本科,互联网/电子商务
图像处理器（ISP）算法/架构工程师（C成都）,芯原微电子（上海）股份有限公司,外资（欧美）,1.5-2.5万/月,成都,1,2021-08-30 04:01:10,,在校生/应届生,硕士,电子技术/半导体/集成电路
人工智能,珠海格力电器股份有限公司,上市公司,1-1.5万/月,成都,1,2021-10-26 09:43:28,,在校生/应届生,硕士,家具/家电/玩具/礼品
算法实习生（成都）,亚信科技(中国)有限公司,外资（欧美）,3-4.5千/月,成都,1,2021-10-26 09:32:24,,在校生/应届生,本科,通信/电信/网络设备
人工智能工程师,北京伯凯科技有限公司,外资（欧美）,3-4.5千/月,成都,1,2021-10-26 04:01:15,,在校生/应届生,本科,多元化业务集团公司
视觉工程师（成都）,征图新视（江苏）科技股份有限公司,民营公司,0.7-1.4万/月,成都,1,2021-10-26 04:01:15,,在校生/应届生,本科,机械/设备/重工
图像处理工程师,瑞晟微电子(苏州)有限公司,外资（非欧美）,1.5-3万/月,成都,1,2021-10-26 04:01:15,,在校生/应届生,硕士,电子技术/半导体/集成电路
AI人工智能,四川中旭智汇科技有限公司,民营公司,6-8千/月,成都-锦江区,1,2021-10-21 17:00:06,,在校生/应届生,大专,计算机软件
DSP软件工程师,凌阳成芯科技（成都）有限公司,外资（非欧美）,0.6-1.2万/月,成都-高新区,1,2021-09-14 10:30:25,,在校生/应届生,本科,计算机服务(系统、数据服务、维修)
信号处理工程师,深圳市特发集团有限公司,国企,1-1.5万/月,成都,1,2021-10-26 04:58:53,,在校生/应届生,本科,房地产
算法设计师,成都中电锦江信息产业有限公司,国企,1.5-2万/月,成都,1,2021-10-26 04:24:05,,在校生/应届生,硕士,电子技术/半导体/集成电路
视觉类管培生(成都),珠海市运泰利自动化设备有限公司,民营公司,0.6-1.1万/月,成都,1,2021-10-26 04:01:15,,在校生/应届生,硕士,仪器仪表/工业自动化
俄语/法语实习生,四川译讯信息科技有限公司,民营公司,1.5千以下/月,成都-高新区,1,2021-10-26 17:00:29,,在校生/应届生,本科,互联网/电子商务
FPGA逻辑工程师,成都福瑞空天科技有限公司,国企,0.8-1.6万/月,成都-双流区,1,2021-10-26 10:27:17,五险一金 补充医疗保险 交通补贴 餐饮补贴 通讯补贴 绩效奖金 年终奖金 定期体检 专业培训,在校生/应届生,本科,航天/航空
音频算法专家 (MJ000863),成都极米科技股份有限公司,民营公司,2.5-5万/月,成都-武侯区,1,2021-09-29 17:40:53,,在校生/应届生,硕士,计算机硬件
算法管培生,中建电子商务有限责任公司,国企,1-1.4万/月,成都-武侯区,1,2021-09-14 14:52:40,五险一金 补充医疗保险 交通补贴 餐饮补贴 通讯补贴 绩效奖金 弹性工作 定期体检,在校生/应届生,本科,互联网/电子商务
气象算法工程师（应届生亦可）,广东纳睿雷达科技股份有限公司,民营公司,1.1-2万/年,珠海,10,2021-10-15 08:22:15,五险一金 绩效奖金 年终奖金 假日福利 股票期权 定期体检,无需经验,硕士,电子技术/半导体/集成电路
资深算法工程师,科文纳仕管理咨询（苏州）有限公司,外资（欧美）,60-120万/年,深圳,5,2021-09-28 20:53:20,,3-4年经验,博士,专业服务(咨询、人力资源、财会)
多媒体算法工程师（视频/显示及AI算法研发）4493,紫光展锐,外资（非欧美）,1.5-3万/月,成都-高新区,4,2021-10-26 11:00:13,,2年经验,硕士,电子技术/半导体/集成电路
算法设计高级工程师,广东欧浮瑞企业管理咨询有限公司,民营公司,3-4.9万/月,成都-高新区,6,2021-10-26 08:22:16,五险一金 餐饮补贴 交通补贴 年终奖金 定期体检 股票期权 免费班车,5-7年经验,本科,计算机软件
人工智能研发工程师,四川砼道科技有限公司,民营公司,9-15万/月,成都-双流区,3,2021-10-20 11:14:19,交通补贴 五险一金 通讯补贴 出国机会 定期体检 餐饮补贴 专业培训 员工旅游 补充医疗保险 弹性工作,1年经验,硕士,建筑/建材/工程
图像识别项目总监,珠海高瑞特医疗科技有限公司,民营公司,7-10万/月,珠海,6,2021-10-26 14:14:46,五险一金 员工旅游 弹性工作 餐饮补贴 年终奖金 绩效奖金 通讯补贴 交通补贴 股票期权 定期体检,5-7年经验,博士,医疗设备/器械
算法工程师,成都卓微科技有限公司,创业公司,1.5-3千/月,成都-成华区,1,2021-10-25 19:00:01,交通补贴 餐饮补贴 专业培训,在校生/应届生,本科,仪器仪表/工业自动化
初级算法工程师,深圳鲲鹏科教有限公司,民营公司,1.2-1.5万/月,成都-武侯区,4,2021-10-26 17:47:13,五险一金 交通补贴 餐饮补贴,2年经验,本科,互联网/电子商务
5G物理层算法工程师,成都爱瑞无线科技有限公司,民营公司,1.5-3万/月,成都-高新区,4,2021-10-26 17:45:36,,2年经验,本科,通信/电信/网络设备
3D点云处理算法工程师,盎锐（上海）信息科技有限公司,外资（非欧美）,1.5-2万/月,成都-高新区,5,2021-10-26 17:35:39,五险一金 员工旅游 交通补贴 餐饮补贴 通讯补贴 专业培训 绩效奖金 年终奖金 弹性工作 定期体检,3-4年经验,本科,电子技术/半导体/集成电路
算法工程师--光学动捕,成都数字天空科技有限公司,民营公司,1.5-2.5万/月,成都,4,2021-10-26 16:29:52,五险一金 补充医疗保险 定期体检 专业培训 试用期全薪,2年经验,硕士,网络游戏
算法工程师（成都）,上海华讯网络系统有限公司,国企,1-2万/月,成都-锦江区,4,2021-10-26 16:22:18,五险一金 补充医疗保险 补充公积金 交通补贴 通讯补贴 年终奖金 定期体检,2年经验,本科,计算机服务(系统、数据服务、维修)
视觉算法工程师——算法（成都）,上海华讯网络系统有限公司,国企,1.5-3万/月,成都-锦江区,5,2021-10-26 16:22:03,五险一金 补充医疗保险 补充公积金 交通补贴 通讯补贴 专业培训 绩效奖金 定期体检,3-4年经验,本科,计算机服务(系统、数据服务、维修)
算法工程师,上海久航电子有限公司,民营公司,0.8-1.6万/月,成都-青羊区,4,2021-10-26 16:18:59,补充医疗保险 补充公积金 专业培训 餐饮补贴 定期体检 绩效奖金 年终奖金 员工旅游,2年经验,本科,电子技术/半导体/集成电路
图像算法工程师,上海久航电子有限公司,民营公司,0.8-1.5万/月,成都-青羊区,5,2021-10-26 16:18:59,补充医疗保险 补充公积金 专业培训 绩效奖金 餐饮补贴 年终奖金 定期体检,3-4年经验,本科,电子技术/半导体/集成电路
算法工程师,成都盟升电子技术股份有限公司,上市公司,1.5-3万/月,成都,3,2021-10-26 16:03:31,五险一金 餐饮补贴 定期体检 绩效奖金 年终奖金 员工旅游 过节费,1年经验,本科,电子技术/半导体/集成电路
雷达算法工程师,广州市埃特斯通讯设备有限公司,民营公司,1.5-2.5万/月,广州,3,2021-10-26 15:43:09,,1年经验,本科,通信/电信/网络设备
高级深度学习算法工程师,成都国铁电气设备有限公司,民营公司,1.2-2万/月,成都-双流区,5,2021-10-26 15:38:20,五险一金 年终奖金 绩效奖金 定期体检 节日福利 专业培训 带薪假 全勤奖 年度旅游 专项奖金,3-4年经验,本科,电子技术/半导体/集成电路
深度学习算法工程师,成都家有为力机器人技术有限公司,民营公司,1.5-3万/月,成都-高新区,4,2021-10-26 15:09:00,五险一金 交通补贴 餐饮补贴 专业培训 周末双休 带薪年假 弹性工作,2年经验,本科,计算机硬件
图像算法工程师,成都家有为力机器人技术有限公司,民营公司,1.5-2.5万/月,成都-高新区,5,2021-10-26 15:09:00,五险一金 交通补贴 餐饮补贴 专业培训 周末双休 带薪年假 弹性工作,3-4年经验,本科,计算机硬件
slam算法工程师,成都家有为力机器人技术有限公司,民营公司,2-3.5万/月,成都-高新区,4,2021-10-26 15:09:00,五险一金 交通补贴 餐饮补贴 专业培训 周末双休 带薪年假 弹性工作,2年经验,本科,计算机硬件
算法工程师,成都家有为力机器人技术有限公司,民营公司,1.8-3万/月,成都-高新区,4,2021-10-26 15:09:00,五险一金 交通补贴 餐饮补贴 专业培训 周末双休 带薪年假 弹性工作,2年经验,本科,计算机硬件
算法工程师,四川丹诺迪科技有限公司,民营公司,0.8-1.5万/月,成都-高新区,10,2021-10-26 14:26:40,,无需经验,本科,制药/生物工程
机器学习算法工程师1,成都图影视讯科技有限公司,民营公司,0.8-1.5万/月,成都-高新区,4,2021-10-26 13:00:01,五险一金 年终奖金 员工旅游 弹性工作,2年经验,硕士,电子技术/半导体/集成电路
算法工程师,成都思腾数联信息技术有限公司,外资（欧美）,1.5-2万/月,成都-高新区,5,2021-10-26 11:59:19,五险一金 补充公积金 绩效奖金 交通补贴 餐饮补贴 补充医疗保险 弹性工作,3-4年经验,本科,计算机软件
图像算法工程师,四川伯乐帮科技有限公司,民营公司,2-3万/月,成都-高新区,5,2021-10-26 11:26:45,绩效奖金 五险一金 年终奖金,3-4年经验,硕士,互联网/电子商务
VSLAM算法工程师,四川伯乐帮科技有限公司,民营公司,1.5-2.5万/月,成都-高新区,5,2021-10-26 11:26:30,绩效奖金 五险一金 年终奖金,3-4年经验,硕士,互联网/电子商务
运控制算法工程师,四川伯乐帮科技有限公司,民营公司,1.5-2.5万/月,成都-高新区,5,2021-10-26 11:26:30,绩效奖金 五险一金 年终奖金,3-4年经验,硕士,互联网/电子商务
CV算法工程师,四川伯乐帮科技有限公司,民营公司,1.5-2.5万/月,成都-高新区,5,2021-10-26 11:26:30,绩效奖金 五险一金 年终奖金,3-4年经验,硕士,互联网/电子商务
飞行控制率算法工程师,四川伯乐帮科技有限公司,民营公司,15-25万/年,成都-郫都区,5,2021-10-26 11:25:10,五险一金 交通补贴 餐饮补贴 通讯补贴 年终奖金,3-4年经验,本科,互联网/电子商务
图像算法开发工程师,四川伯乐帮科技有限公司,民营公司,2-3万/月,成都-高新区,6,2021-10-26 11:25:10,五险一金,5-7年经验,本科,互联网/电子商务
AI算法工程师,四川伯乐帮科技有限公司,民营公司,2-4万/月,成都-高新区,5,2021-10-26 11:25:10,五险一金,3-4年经验,本科,互联网/电子商务
图像算法工程师,四川伯乐帮科技有限公司,民营公司,1.5-2.5万/月,成都-龙泉驿区,5,2021-10-26 11:25:10,五险一金,3-4年经验,硕士,互联网/电子商务
雷达信号处理算法工程师,四川伯乐帮科技有限公司,民营公司,1.5-2.5万/月,成都-龙泉驿区,5,2021-10-26 11:25:10,五险一金,3-4年经验,本科,互联网/电子商务
人工智能算法工程师,上海交通大学四川研究院,事业单位,1.5-2万/月,成都-双流区,4,2021-10-26 10:28:46,五险一金 专业培训 绩效奖金 定期体检 带薪年假 部门团建 生日福利,2年经验,硕士,学术/科研
多线激光slam算法工程师(J10153),深圳市普渡科技有限公司,民营公司,2-4万/月,深圳,3,2021-10-26 10:03:05,,1年经验,本科,计算机硬件
卫星导航定位算法工程师,成都华力创通科技有限公司,民营公司,1-2万/月,成都-天府新区,5,2021-10-26 09:55:17,五险一金 员工旅游 餐饮补贴 通讯补贴 专业培训 出国机会 绩效奖金 年终奖金 股票期权 定期体检,3-4年经验,本科,电子技术/半导体/集成电路
高精度算法工程师,成都华力创通科技有限公司,民营公司,1.5-2.5万/月,成都-高新区,5,2021-10-26 09:55:17,五险一金 员工旅游 餐饮补贴 通讯补贴 专业培训 出国机会 绩效奖金 年终奖金 股票期权 定期体检,3-4年经验,硕士,电子技术/半导体/集成电路
PVT算法工程师,成都华力创通科技有限公司,民营公司,1.5-2万/月,成都-天府新区,5,2021-10-26 09:55:17,五险一金 员工旅游 餐饮补贴 通讯补贴 专业培训 出国机会 绩效奖金 年终奖金 股票期权 定期体检,3-4年经验,本科,电子技术/半导体/集成电路
通信算法工程师,成都华力创通科技有限公司,民营公司,1.5-3万/月,成都-高新区,5,2021-10-26 09:55:17,五险一金 员工旅游 餐饮补贴 通讯补贴 专业培训 出国机会 绩效奖金 年终奖金 股票期权 定期体检,3-4年经验,硕士,电子技术/半导体/集成电路
数据算法工程师,中国电子科技集团公司第十研究所,事业单位,1.5-2万/月,成都-金牛区,4,2021-10-26 09:51:45,五险一金 补充医疗保险 通讯补贴 餐饮补贴 专业培训 绩效奖金 年终奖金 定期体检 住房补贴 单身宿舍,2年经验,硕士,电子技术/半导体/集成电路
视觉算法储备工程师,成都高昕光学科技有限公司,民营公司,0.6-1万/月,成都-郫都区,10,2021-10-26 09:43:46,五险一金 交通补贴 通讯补贴 定期体检 餐饮补贴 周末双休 法定节假日,无需经验,硕士,学术/科研
算法工程师,电信科学技术第五研究所有限公司,国企,1-1.2万/月,成都,4,2021-10-26 09:41:46,五险两金 年底双薪 绩效奖金 餐饮补贴 试用期全额 全额公积金 补充医疗保险 每年多次调薪 节日福利 三甲医院体检,2年经验,本科,通信/电信/网络设备
图像算法工程师,网思科技股份有限公司,民营公司,1-2万/月,成都-武侯区,5,2021-10-26 09:27:42,弹性工作 通讯补贴 绩效奖金 员工旅游 年终奖金 餐饮补贴 节日福利 周末双休 包吃 带薪年假,3-4年经验,本科,计算机服务(系统、数据服务、维修)
算法工程师-信号分析,成都运达科技股份有限公司,上市公司,1.3-1.8万/月,成都,5,2021-10-26 09:26:05,五险一金 补充医疗保险 补充公积金 通讯补贴 交通补贴 绩效奖金 年终奖金 定期体检,3-4年经验,硕士,计算机软件
图像算法工程师,成都运达科技股份有限公司,上市公司,1.5-2.5万/月,成都,5,2021-10-26 09:25:45,五险一金 补充医疗保险 通讯补贴 交通补贴 年终奖金 定期体检 弹性工作 包吃,3-4年经验,本科,计算机软件
SLAM算法工程师,成都运达科技股份有限公司,上市公司,1.5-2万/月,成都,5,2021-10-26 09:25:45,五险一金 绩效奖金 专业培训 定期体检 员工旅游 弹性工作 交通补贴,3-4年经验,本科,计算机软件
算法工程师,四川东方水利智能装备工程股份有限公司,民营公司,0.8-1.5万/月,成都-成华区,3,2021-10-26 09:22:11,五险一金 补充医疗保险 交通补贴 年终奖金 绩效奖金 餐饮补贴 专业培训,1年经验,本科,机械/设备/重工
高级算法工程师,成都路行通信息技术有限公司,民营公司,2-5万/月,成都-高新区,6,2021-10-26 09:20:47,周末双休 带薪年假 团队活动 节日福利 五险一金 员工餐厅 年终奖金,5-7年经验,硕士,计算机服务(系统、数据服务、维修)
语音识别算法工程师,成都民航空管科技发展有限公司,国企,20-30万/年,成都-武侯区,10,2021-10-26 09:19:00,五险一金 补充医疗保险 餐饮补贴 通讯补贴 绩效奖金 年终奖金 定期体检,无需经验,本科,计算机软件
通信信号处理算法工程师,成都星联芯通科技有限公司,民营公司,1.5-3万/月,成都-高新区,4,2021-10-26 09:14:25,五险一金 补充医疗保险 绩效奖金 定期体检 员工旅游 交通补贴 年终奖金 专业培训 股票期权,2年经验,硕士,通信/电信/网络设备
卫星导航算法工程师（成都）,重庆天箭惯性科技股份有限公司,民营公司,1.8-2.5万/月,成都-高新区,5,2021-10-26 09:07:07,五险一金 员工旅游 餐饮补贴 定期体检 年终奖金 绩效奖金 交通补贴,3-4年经验,硕士,电子技术/半导体/集成电路
高级视觉算法工程师,四川深瑞视科技有限公司,创业公司,15-30万/年,成都-武侯区,5,2021-10-26 09:00:07,,3-4年经验,硕士,计算机软件
深度视觉算法工程师,四川深瑞视科技有限公司,创业公司,10-30万/年,成都-武侯区,4,2021-10-26 09:00:07,,2年经验,本科,计算机软件
机器学习算法工程师,成都心吉康科技有限公司,民营公司,2-3万/月,成都-高新区,4,2021-10-26 08:55:01,五险一金 股票期权 专业培训 定期体检 生日福利 节日福利 加班补助 补充医疗保险 周末双休 餐补,2年经验,本科,医疗设备/器械
深度学习算法工程师,成都利君实业股份有限公司,上市公司,1-1.5万/月,成都-武侯区,5,2021-10-26 08:53:35,五险一金 定期体检 绩效奖金 年终奖金 周末双休 节日福利,3-4年经验,硕士,机械/设备/重工
DBF算法工程师,成都振芯科技股份有限公司,民营公司,2-3万/月,成都-高新区,5,2021-10-26 08:53:00,五险一金 餐饮补贴 绩效奖金 年终奖金 定期体检,3-4年经验,本科,电子技术/半导体/集成电路
